{
  "id": "hcb-north-to-green-nw",
  "from": {
    "kind": "building-entrance",
    "building": "HCB",
    "entrance": "north-plaza"
  },
  "to": {
    "kind": "waypoint",
    "waypoint": "green-northwest-corner"
  },
  "bidirectional": true,
  "distanceMeters": 165,
  "baseDurationSeconds": 118,
  "durationSource": "measured",
  "measurement": {
    "sampleCount": 6,
    "measuredAt": "2026-08-20",
    "medianSeconds": 118,
    "p90Seconds": 141,
    "method": "stopwatch"
  },
  "paceAssumption": {
    "metersPerSecond": 1.4,
    "profile": "average"
  },
  "surface": "paved-sidewalk",
  "coverage": "partial",
  "coveredFraction": 0.3,
  "accessibility": {
    "wheelchairAccessible": true,
    "accessibleRouteOnly": false,
    "hasStairs": false,
    "maxGradePercent": 3.5
  },
  "crowdFactors": [
    {
      "window": {
        "daysOfWeek": [
          "monday",
          "wednesday",
          "friday"
        ],
        "startTime": "09:45",
        "endTime": "10:05"
      },
      "multiplier": 1.35,
      "reason": "class-change",
      "confidence": "estimated"
    },
    {
      "window": {
        "daysOfWeek": [
          "monday",
          "tuesday",
          "wednesday",
          "thursday",
          "friday"
        ],
        "startTime": "12:00",
        "endTime": "13:00"
      },
      "multiplier": 1.15,
      "reason": "lunch-rush",
      "confidence": "estimated"
    }
  ],
  "notes": "ILLUSTRATIVE PLACEHOLDER RECORD. Distances, durations, and crowd multipliers are invented. Replace with measured data before shipping.",
  "provenance": {
    "retrievedOn": "2026-08-27",
    "method": "unverified",
    "confidence": "low",
    "note": "Illustrative example, not real campus data. method \"unverified\" is the correct label for an invented record and is exactly what tools/validate-data.mjs refuses to let into plugins/nole-schedule/data/. Examples are allowed to carry it; shipped records are not."
  },
  "source": {
    "label": "Placeholder example, not a real source",
    "retrievedAt": "2026-08-27T10:00:00-04:00",
    "confidence": "unknown"
  }
}
